"text","draw","pick","watermark","name","base_deck","card_set_id"
"I always ____ ass - razor1000.",0,1,"Imgur","[C] Imgur",f,100443
"I got ____ to the frontpage ",0,1,"Imgur","[C] Imgur",f,100443
"Not asking for upvotes but ____.",0,1,"Imgur","[C] Imgur",f,100443
"Not sure if Imgur reference or ____.",0,1,"Imgur","[C] Imgur",f,100443
"ERMAGERD! ____.",0,1,"Imgur","[C] Imgur",f,100443
"Press 0 twice for ____.",0,1,"Imgur","[C] Imgur",f,100443
"Having a bit of fun with the new ____.",0,1,"Imgur","[C] Imgur",f,100443
"I know this is a selfie but ____.",0,1,"Imgur","[C] Imgur",f,100443
"I know this is going to get downvoted to hell but ____.",0,1,"Imgur","[C] Imgur",f,100443
"If you could stop ____, that’d be greeeeattt. ",0,1,"Imgur","[C] Imgur",f,100443
"Imgur: where the points don’t matter and the ____ is made up.",0,1,"Imgur","[C] Imgur",f,100443
"____ ____ Divided By ____.",2,3,"FiM1","[C] FiMFiction.net",f,100444
"____ <br>~Skeeter The Lurker",0,1,"FiM1","[C] FiMFiction.net",f,100444
"____ adds a thread in the Anti-____ group, and everybody loses their fucking minds.",1,2,"FiM1","[C] FiMFiction.net",f,100444
"____ is the least autistic ____ on Fimfiction.",1,2,"FiM1","[C] FiMFiction.net",f,100444
"____ is Best Pony.",0,1,"FiM1","[C] FiMFiction.net",f,100444
"____ signalled the end of the ____ Age of FiMfiction.net.",1,2,"FiM1","[C] FiMFiction.net",f,100444
"____ posted that they're not working on fics for a while, because ____.",1,2,"FiM1","[C] FiMFiction.net",f,100444
"____ was a strong stallion.",0,1,"FiM1","[C] FiMFiction.net",f,100444
"____ signalled the end of the Golden Age of FiMfiction.net.",0,1,"FiM1","[C] FiMFiction.net",f,100444
"A clopfic about ____ with ____, and ____ is a sexy orphan.",2,3,"FiM1","[C] FiMFiction.net",f,100444
"____, ____, and ____ in a sexy circlejerk.",2,3,"FiM1","[C] FiMFiction.net",f,100444
"Fallout Equestria is ____ and tends to overdramaticize its ____.",0,2,"FiM1","[C] FiMFiction.net",f,100444
"An alternate universe where ____ is instead ____.",1,2,"FiM1","[C] FiMFiction.net",f,100444
"I commissioned a picture of ____ violating ____ with ____'s dick.",2,3,"FiM1","[C] FiMFiction.net",f,100444
"Hey, let's cross over ____ and MLP! Why the fuck not?",0,1,"FiM1","[C] FiMFiction.net",f,100444
"I just read a fic where ____ was fucking ____.",1,2,"FiM1","[C] FiMFiction.net",f,100444
"I hope someone writes a fic about ____ because I am too fucking lazy to do it myself.",0,1,"FiM1","[C] FiMFiction.net",f,100444
"I swear I'm going to quit the fandom if ____ happens.",0,1,"FiM1","[C] FiMFiction.net",f,100444
"I just started the ____verse.",0,1,"FiM1","[C] FiMFiction.net",f,100444
"The Incredible ____ Of A Winning ____.",1,2,"FiM1","[C] FiMFiction.net",f,100444
"The cardinal sin of FiMFic noobs: _____ without ______",0,2,"FiM1","[C] FiMFiction.net",f,100444
"The ____ Group of ____ Excellence.",1,2,"FiM1","[C] FiMFiction.net",f,100444
"The ____ Bureau.",0,1,"FiM1","[C] FiMFiction.net",f,100444
"That fucking idiot ____ ragequit the fandom over ____.",1,2,"FiM1","[C] FiMFiction.net",f,100444
"Someone should write a clopfic of ____ fucking ____, using ____ as lubricant.",2,3,"FiM1","[C] FiMFiction.net",f,100444
"Short Skirts and ____.",0,1,"FiM1","[C] FiMFiction.net",f,100444
"Remember when ____ was on every page?",0,1,"FiM1","[C] FiMFiction.net",f,100444
"RainbowBob's newest clopfic: ____ X ____",0,2,"FiM1","[C] FiMFiction.net",f,100444
"Oh, look, ____ made a fan group for themselves.",0,1,"FiM1","[C] FiMFiction.net",f,100444
"Oh, fuck, someone made a group about ____.",0,1,"FiM1","[C] FiMFiction.net",f,100444
"My OTP is ____ and ____.",1,2,"FiM1","[C] FiMFiction.net",f,100444
"My Little Dashie? How about My Little ____?",0,1,"FiM1","[C] FiMFiction.net",f,100444
"My ____ Pony",0,1,"FiM1","[C] FiMFiction.net",f,100444
"knighty's new blogpost is about ____",0,1,"FiM1","[C] FiMFiction.net",f,100444
"If only people bothered to read Ezn's ____ Guide!",0,1,"FiM1","[C] FiMFiction.net",f,100444
"There's a crossover fic about ____ and ____ in the FB.",0,2,"FiM1","[C] FiMFiction.net",f,100444
"____: ____ in fiction, ____ on the tabletop.",1,3,"/tg/","[C] /tg/",f,100445
"Next up: Lord Lysander's paints ____.",0,1,"/tg/","[C] /tg/",f,100445
"I proxy ____ using a second-hand ____.",0,2,"/tg/","[C] /tg/",f,100445
"I am Angry, Angry about ____.",0,1,"/tg/","[C] /tg/",f,100445
"The citizens of Innsmouth are really ____!",0,1,"/tg/","[C] /tg/",f,100445
"____ falls, everyone dies.",0,1,"/tg/","[C] /tg/",f,100445
"My GM just made his girlfriend a ____ character. How fucked are we?",0,1,"/tg/","[C] /tg/",f,100445
"If you buy a camel, Crazy Hassan is adding in free ____ this week only!",0,1,"/tg/","[C] /tg/",f,100445
"Around elves, watch ____",0,1,"/tg/","[C] /tg/",f,100445
"The only good ____ is a dead ____",1,2,"/tg/","[C] /tg/",f,100445
"...And then he killed the Tarasque with a ____",0,1,"/tg/","[C] /tg/",f,100445
"There is a ____ on the roof.",0,1,"/tg/","[C] /tg/",f,100445
"What are we going to argue about today?",0,1,"/tg/","[C] /tg/",f,100445
"In respect to your chapter, the Blood Ravens have dedicated one of their____to ____.",0,2,"/tg/","[C] /tg/",f,100445
"Roll for ____.",0,1,"/tg/","[C] /tg/",f,100445
"I prepared ____ this morning.",0,1,"/tg/","[C] /tg/",f,100445
"The bard nearly got us killed when he rolled to seduce ____.",0,1,"/tg/","[C] /tg/",f,100445
"____ causes the Paladin to fall",0,1,"/tg/","[C] /tg/",f,100445
"The door to the FLGS opens and a ____ walks in!",0,2,"/tg/","[C] /tg/",f,100445
"GW stores no longer stock____",0,1,"/tg/","[C] /tg/",f,100445
"The price on ____ Has doubled!",0,1,"/tg/","[C] /tg/",f,100445
"You fool! you fell victim to one of the classic blunders: ____.",0,1,"/tg/","[C] /tg/",f,100445
"...and then the bastard pulled out ____ and placed it on the table.",0,1,"/tg/","[C] /tg/",f,100445
"I cast magic missile at ____.",0,1,"/tg/","[C] /tg/",f,100445
"Wait! I'm a ____! Let me tell you about my ____!",0,2,"/tg/","[C] /tg/",f,100445
"Whenever we run ____, it's customary that ____ pays for the group's pizza.",0,2,"/tg/","[C] /tg/",f,100445
"I kept getting weird looks at FNM when I brought my new ____ card sleeves.",0,1,"/tg/","[C] /tg/",f,100445
"What is better than 3D women?",0,1,"/tg/","[C] /tg/",f,100445
"Only fags play mono____.",0,1,"/tg/","[C] /tg/",f,100445
"The enemy's ____ is down.",0,1,"/tg/","[C] /tg/",f,100445
"Ach! Hans run! It's the ____!",0,1,"/tg/","[C] /tg/",f,100445
"What is the BBEG's secret weapon?",0,1,"/tg/","[C] /tg/",f,100445
"____ is the only way to fix 3.5.",0,1,"/tg/","[C] /tg/",f,100445
"What's on today's agenda for the mage guild meeting?",0,1,"/tg/","[C] /tg/",f,100445
"You roll 00 for your magical mishap and turn into ____.",0,1,"/tg/","[C] /tg/",f,100445
"____! what was that?",0,1,"/tg/","[C] /tg/",f,100445
"What won't the Bard fuck?.",0,1,"/tg/","[C] /tg/",f,100445
"The last straw was the Chaotic Neutral buying a case of ____.",0,1,"/tg/","[C] /tg/",f,100445
"Your BBEG is actually ____!",0,1,"/tg/","[C] /tg/",f,100445
"The adventure was going fine until the BBEG put ____ in our path.",0,1,"/tg/","[C] /tg/",f,100445
"You've been cursed by the witch! Your ____ has turned into a ____!",0,2,"/tg/","[C] /tg/",f,100445
"I like to dress up like ____ and hit people with foam swords.",0,1,"/tg/","[C] /tg/",f,100445
"Mountain, Black lotus, sac, to cast ____.",0,1,"/tg/","[C] /tg/",f,100445
"____ followed by gratuitous ____ is how I got kicked out off my last group.",0,2,"/tg/","[C] /tg/",f,100445
"The ____ guides my blade.",0,1,"/tg/","[C] /tg/",f,100445
"Don't touch me ____!",0,1,"/tg/","[C] /tg/",f,100445
"The GM has invited his new ____ to join the game. They'll be playing ____.",1,2,"/tg/","[C] /tg/",f,100445
"0/10 would not ____.",0,1,"/tg/","[C] /tg/",f,100445
"Behold! White Wolf's newest game: ____: the ____.",1,2,"/tg/","[C] /tg/",f,100445
"For our upcoming FATAL game, I've assigned ____ as your new character.",0,1,"/tg/","[C] /tg/",f,100445
"I had to kill a party member when wasted 2 hours by ____.",0,1,"/tg/","[C] /tg/",f,100445
"We found ____in the Dragon's hoard.",0,1,"/tg/","[C] /tg/",f,100445
"We knew the game was off to a good start when the GM didn't veto a player's decision to play as ____.",0,1,"/tg/","[C] /tg/",f,100445
"My Kriegers came in a box of ____!",0,1,"/tg/","[C] /tg/",f,100445
"Elf ____ Wat do?",0,1,"/tg/","[C] /tg/",f,100445
"Magic the Gathering's next set is themed around ____.",0,1,"/tg/","[C] /tg/",f,100445
"Everybody was surprised when the king's trusted adviser turned out to be ____.",0,1,"/tg/","[C] /tg/",f,100445
"You and ____ must stop ____ with the ancient artifact ____.",1,3,"/tg/","[C] /tg/",f,100445
"The guard looks a troubled, uncomfortable glare, like a man who must explain to his ____, that's its dreams of becoming ____ will never happen.",1,2,"/tg/","[C] /tg/",f,100445
"____ just fucked us",0,1,"/tg/","[C] /tg/",f,100445
"My ____ are moving on their own",0,1,"/tg/","[C] /tg/",f,100445
"Dwarf Fortress needs more ____",0,1,"/tg/","[C] /tg/",f,100445
"2e or ____",0,1,"/tg/","[C] /tg/",f,100445
"In the grim darkness of the far future there is only ____",0,1,"/tg/","[C] /tg/",f,100445
"____. we don't need other boards anymore!",0,1,"/tg/","[C] /tg/",f,100445
"Blood for the blood god! ____ for the ____!",1,2,"/tg/","[C] /tg/",f,100445
"Never fire ____ at the bulkhead!",0,1,"/tg/","[C] /tg/",f,100445
"Macha was dismayed to find out that ____.",0,1,"/tg/","[C] /tg/",f,100445
"I sure hope no one notices that I inserted my ____ fetish into the game.",0,1,"/tg/","[C] /tg/",f,100445
"____ is the only way I can forget about 4e.",0,1,"/tg/","[C] /tg/",f,100445
"You should never let your bard ____.",0,1,"/tg/","[C] /tg/",f,100445
"Welcome to the ____ Quest Thread.",0,1,"/tg/","[C] /tg/",f,100445
"The lich's phylactery is a  ____!",0,1,"/tg/","[C] /tg/",f,100445
"That one guy in my group always rolls a chaotic neutral ____.",0,1,"/tg/","[C] /tg/",f,100445
"Then the barbarian drank from the ____-filled fountain",0,1,"/tg/","[C] /tg/",f,100445
"____: That was a thing.",0,1,"/tg/","[C] /tg/",f,100445
"&gt;preferring 3D women over ____",0,1,"/tg/","[C] /tg/",f,100445
"Where we're going, we won't need ____ to see",0,1,"/tg/","[C] /tg/",f,100445
"I got a box today. What's inside? ____",0,1,"/tg/","[C] /tg/",f,100445
"Roll ____ circumference",0,1,"/tg/","[C] /tg/",f,100445
"What I made: ____.<br>What the DM saw: ____.<br>What I played: ____",2,3,"/tg/","[C] /tg/",f,100445
"____ vs. ____: Critical Hit!",1,2,"/tg/","[C] /tg/",f,100445
"Can ____ bloom on the battlefield?",0,1,"/tg/","[C] /tg/",f,100445
"&gt;mfw ____.",0,1,"/tg/","[C] /tg/",f,100445
"____? That's ULTRA heretical",0,1,"/tg/","[C] /tg/",f,100445
"So I made my chapter insignia ____",0,1,"/tg/","[C] /tg/",f,100445
"You encounter a Gazebo. You respond with ____",0,1,"/tg/","[C] /tg/",f,100445
"D&amp;D: 6th edition will feature ____ as a main race!",0,1,"/tg/","[C] /tg/",f,100445
"Your Natural 1 summons ____.",0,1,"/tg/","[C] /tg/",f,100445
"It would have taken ____ to..... CREEEEEEEEEED!",0,1,"/tg/","[C] /tg/",f,100445
"Did you know you can just buy ____?",0,1,"xkcd","[C] xkcd",f,100446
"My new favorite game is Strip ____.",0,1,"xkcd","[C] xkcd",f,100446
"Now I have to live my whole life pretending ____ never happened. It's going to be a fun 70 years.",0,1,"xkcd","[C] xkcd",f,100446
"____'s fetish: ____.",0,2,"xkcd","[C] xkcd",f,100446
"2009 called? Did you warn them about ____?",0,1,"xkcd","[C] xkcd",f,100446
"Just because I have ____ doesn't mean you could milk me now. I'd have to be lactating.",0,1,"xkcd","[C] xkcd",f,100446
"____. That's right. Shit just got REAL.",0,1,"xkcd","[C] xkcd",f,100446
"Take me down to the ____, where the ____ is green and the ____ are pretty.",2,3,"xkcd","[C] xkcd",f,100446
"Did you know November is ____ Awareness Month?",0,1,"xkcd","[C] xkcd",f,100446
"Until I see more data, I'm going to assume ____ causes ____.",0,2,"xkcd","[C] xkcd",f,100446
"3D printers sound great until you receive spam containing actual ____.",0,1,"xkcd","[C] xkcd",f,100446
"I'm going to name my child ____.",0,1,"xkcd","[C] xkcd",f,100446
"____. So it has come to this.",0,1,"xkcd","[C] xkcd",f,100446
"If you really hate someone, teach them to recognize ____.",0,1,"xkcd","[C] xkcd",f,100446
"It's fun to mentally replace the word ____ with ____.",0,1,"xkcd","[C] xkcd",f,100446
"University Researchers create life in lab! ____ blamed!",0,1,"xkcd","[C] xkcd",f,100446
"Ebay review: Instead of ____, package contained ____. Would not buy again.",0,2,"xkcd","[C] xkcd",f,100446
"Social rule 99.1: If friends spend more than 60 minutes deciding what to do, they must default to ____.",0,1,"xkcd","[C] xkcd",f,100446
"The #1 Programmer's excuse for legitimately slacking off: ____.",0,1,"xkcd","[C] xkcd",f,100446
"I like alter songs by replacing ____ with ____.",0,2,"xkcd","[C] xkcd",f,100446
"Real Programmers use ____.",0,1,"xkcd","[C] xkcd",f,100446
"After finding Higgs-Boson, I can always use the LHC for ____.",0,1,"xkcd","[C] xkcd",f,100446
"____ linked to Acne! 95% confidence.",0,1,"xkcd","[C] xkcd",f,100446
"How many Google results are there for ""Died in a ____ accident?""",0,1,"xkcd","[C] xkcd",f,100446
"What's my favorite unit of measurement?",0,1,"xkcd","[C] xkcd",f,100446
"In the extended base metaphor, shortstop is ____.",0,1,"xkcd","[C] xkcd",f,100446
"My health declined when I realized I could eat ____ whenever I wanted.",0,1,"xkcd","[C] xkcd",f,100446
"____ is just applied ____.",0,2,"xkcd","[C] xkcd",f,100446
"I set up script to buy things on ebay for $1, but then it bought ____, ____, and ____.",2,3,"xkcd","[C] xkcd",f,100446
"I can extrude ____, but I can't retract it.",0,1,"xkcd","[C] xkcd",f,100446
"I don't actually care about ____, I just like ____.",0,2,"xkcd","[C] xkcd",f,100446
"Why do you have a crossbow in your desk?",0,1,"xkcd","[C] xkcd",f,100446
"Spoiler Alert! ____ kills ____ with ____!",2,3,"xkcd","[C] xkcd",f,100446
"I'm like ____, except with love.",0,1,"xkcd","[C] xkcd",f,100446
"Do you really expect ____? No, Mister Bond. I expect you to die!",0,1,"xkcd","[C] xkcd",f,100446
"I didn't actually want you to be ____; I just wanted you to be ____.",0,2,"xkcd","[C] xkcd",f,100446
"I filled my apartment with ____.",0,1,"xkcd","[C] xkcd",f,100446
"What do we miss most from the internet in 1998?",0,1,"xkcd","[C] xkcd",f,100446
"Waking up would be a lot easier if ____ didn't look so much like you.",0,1,"xkcd","[C] xkcd",f,100446
"All of my algorithms were really just disguised ____.",0,1,"xkcd","[C] xkcd",f,100446
"I got a lot more interested in ____ when I made the connection to ____.",0,2,"xkcd","[C] xkcd",f,100446
"____? No, I'm not really into Pokémon.",0,1,"xkcd","[C] xkcd",f,100446
"When I eat ____, I like to pretend I'm a Turing machine.",0,1,"xkcd","[C] xkcd",f,100446
"Dreaming about ____ in Cirque du Soleil.",0,1,"xkcd","[C] xkcd",f,100446
"It turns out God created the universe using ____.",0,1,"xkcd","[C] xkcd",f,100446
"Freestyle rapping is really just ____.",0,1,"xkcd","[C] xkcd",f,100446
"If I could rearrange the alphabet, I'd put ____ and ____ together.",0,2,"xkcd","[C] xkcd",f,100446
"Human intelligence decreases with increasing proximity to ____.",0,1,"xkcd","[C] xkcd",f,100446
"____ would be a good name for a band.",0,1,"xkcd","[C] xkcd",f,100446
"____ wouldn't be funny if not for the irony.",0,1,"xkcd","[C] xkcd",f,100446
"Help, I'm trapped in a ____ factory!",0,1,"xkcd","[C] xkcd",f,100446
"None of the places I floated to had ____.",0,1,"xkcd","[C] xkcd",f,100446
"____. My normal method is useless here.",0,1,"xkcd","[C] xkcd",f,100446
"We had a ____ party, but it turned out not to be very much fun.",0,1,"xkcd","[C] xkcd",f,100446
"My hobby: ____.",0,1,"xkcd","[C] xkcd",f,100446
"____ makes terrible pillow talk.",0,1,"xkcd","[C] xkcd",f,100446
"What is the best way to protect yourself from Velociraptors?",0,1,"xkcd","[C] xkcd",f,100446
"I'm pretty sure you can't send ____ through the mail.",0,1,"xkcd","[C] xkcd",f,100446
"____.tumblr.com",0,1,"SG","[C] xkcd",f,100446
"What did I suggest to the IAU for a new planet name?",0,1,"xkcd","[C] xkcd",f,100446
"____ is too big for small talk.",0,1,"xkcd","[C] xkcd",f,100446
"New movie this summer: ____ beats up everyone.",0,1,"xkcd","[C] xkcd",f,100446
"By 2019, ____ will be outnumbered by ____.",0,2,"xkcd","[C] xkcd",f,100446
"The past is a foreign country... with ____ and ____!",0,2,"xkcd","[C] xkcd",f,100446
"Hey baby, wanna come back to my sex ____?",0,1,"xkcd","[C] xkcd",f,100446
"____. It works in Kerbal Space Program.",0,1,"xkcd","[C] xkcd",f,100446
"What role has social media played in ____? Well, it's certainly made ____ stupider.",0,2,"xkcd","[C] xkcd",f,100446
"Mewtwo achieved a utopian society when he eliminated ____ once and for all.",0,1,"RPF","[C] RagingPsyfag's Pack of Shenanigans",f,100447
"The only thing that caused more of a shitfit than Mewtwo's new form is ____.",0,1,"RPF","[C] RagingPsyfag's Pack of Shenanigans",f,100447
"The idiots in that one room at the Westin finally got kicked out of Anthrocon for ____.",0,1,"RPF","[C] RagingPsyfag's Pack of Shenanigans",f,100447
"Furaffinity went down for 48 hours because of ____.",0,1,"RPF","[C] RagingPsyfag's Pack of Shenanigans",f,100447
"My most shameful orgasm was the time I masturbated to ____.",0,1,"RPF","[C] RagingPsyfag's Pack of Shenanigans",f,100447
"I got an STD from ____.",0,1,"RPF","[C] RagingPsyfag's Pack of Shenanigans",f,100447
"____ is serious business.",0,1,"RPF","[C] RagingPsyfag's Pack of Shenanigans",f,100447
"If you don't pay your Comcast cable bill, they will send ____ after you.",0,1,"RPF","[C] RagingPsyfag's Pack of Shenanigans",f,100447
"What are the worst 3 cards in your hand right now?",2,3,"RPF","[C] RagingPsyfag's Pack of Shenanigans",f,100447
"Yu-Gi-Oh players were shocked when the win condition of holding 5 Exodia pieces was replaced by ____, ____, and ____. ",2,3,"RPF","[C] RagingPsyfag's Pack of Shenanigans",f,100447
"In recent tech news, computers are now being ruined by ____.",0,1,"RPF","[C] RagingPsyfag's Pack of Shenanigans",f,100447
"I was fapping to ____, but ____ walked in on me.",0,2,"RPF","[C] RagingPsyfag's Pack of Shenanigans",f,100447
"____ ruined the ____ fandom for all eternity.",0,2,"RPF","[C] RagingPsyfag's Pack of Shenanigans",f,100447
"You don't want to find ____ in your Furnando's Lasagna Wrap.",0,1,"RPF","[C] RagingPsyfag's Pack of Shenanigans",f,100447
"I unwatched his FurAffinity page because he kept posting ____.",0,1,"RPF","[C] RagingPsyfag's Pack of Shenanigans",f,100447
"Anthrocon was ruined by ____.",0,1,"RPF","[C] RagingPsyfag's Pack of Shenanigans",f,100447
"Calliborn wants you to draw pornography of ____.",0,1,"MSPA","[C] Cards Against Homestuck",f,100448
"Whenever I see ____ on MSPARP, I disconnect immediately.",0,1,"MSPA","[C] Cards Against Homestuck",f,100448
"____ totally makes me question my sexuality.",0,1,"MSPA","[C] Cards Against Homestuck",f,100448
"When Dave received ____ from his Bro for his 9th birthday, be felt a little warm inside.",0,1,"MSPA","[C] Cards Against Homestuck",f,100448
"When a bucket is unavailable, trolls with use ____.",0,1,"MSPA","[C] Cards Against Homestuck",f,100448
"What's in the box, Jack?",0,1,"MSPA","[C] Cards Against Homestuck",f,100448
"What makes your kokoro go ""doki doki""?",0,1,"MSPA","[C] Cards Against Homestuck",f,100448
"____. On the roof. Now.",0,1,"MSPA","[C] Cards Against Homestuck",f,100448
"Your name is JOHN EGBERT and boy do you love ____!",0,1,"MSPA","[C] Cards Against Homestuck",f,100448
"where doing it man. where MAKING ____ HAPEN!",0,1,"MSPA","[C] Cards Against Homestuck",f,100448
"The hole in Kanaya's stomach is so large, she can fit ____ in it.",0,1,"MSPA","[C] Cards Against Homestuck",f,100448
"Turns out, pre-entry prototyping with ____ was not the best idea.",0,1,"MSPA","[C] Cards Against Homestuck",f,100448
"Vriska killed Spidermom with ____.",0,1,"MSPA","[C] Cards Against Homestuck",f,100448
"Vriska roleplays ____ with Terezi as ____.",0,2,"MSPA","[C] Cards Against Homestuck",f,100448
"Vriska's greatest regret is ____.",0,1,"MSPA","[C] Cards Against Homestuck",f,100448
"Wear  ____. Be ____.",0,2,"MSPA","[C] Cards Against Homestuck",f,100448
"What did Jake get Dirk for his birthday?",0,1,"MSPA","[C] Cards Against Homestuck",f,100448
"What is the worst thing that Terezi ever licked?",0,1,"MSPA","[C] Cards Against Homestuck",f,100448
"What is your OT3?",2,3,"MSPA","[C] Cards Against Homestuck",f,100448
"The only way to beat Vriska in an eating contest is to put ____ on the table.",0,1,"MSPA","[C] Cards Against Homestuck",f,100448
"Porrim made Kankri a sweater to cover his ____.",0,1,"MSPA","[C] Cards Against Homestuck",f,100448
"Problem Sleuth had a hard time investigating ____.",0,1,"MSPA","[C] Cards Against Homestuck",f,100448
"The real reason Terezi stabbed Vriska was to punish her for ____.",0,1,"MSPA","[C] Cards Against Homestuck",f,100448
"Rose was rather disgusted when she started reading about ____.",0,1,"MSPA","[C] Cards Against Homestuck",f,100448
"The secret way to achieve God Tier is to die on top of ____.",0,1,"MSPA","[C] Cards Against Homestuck",f,100448
"Terezi can top anyone except ____.",0,1,"MSPA","[C] Cards Against Homestuck",f,100448
"The thing that made Kankri break his vow of celibacy was ____.",0,1,"MSPA","[C] Cards Against Homestuck",f,100448
"Little did they know, the key to defeating Lord English was actually ____.",0,1,"MSPA","[C] Cards Against Homestuck",f,100448
"Latula and Porrin have decided to teach Kankri about the wonders of ____.",0,1,"MSPA","[C] Cards Against Homestuck",f,100448
"Nanna baked a cake for John to commemorate ____.",0,1,"MSPA","[C] Cards Against Homestuck",f,100448
"Little known fact: Kurloz's stitching is actually made out of ____.",0,1,"MSPA","[C] Cards Against Homestuck",f,100448
"Nepeta's secret OTP is ____ with ____.",0,2,"MSPA","[C] Cards Against Homestuck",f,100448
"Nepeta only likes Karkat for his ____.",0,1,"MSPA","[C] Cards Against Homestuck",f,100448
"Nobody was surprised to find ____ under Jade's skirt. The surprise was she used it for/on ____.",0,2,"MSPA","[C] Cards Against Homestuck",f,100448
"The next thing Hussie will turn into a sex joke will be ____.",0,1,"MSPA","[C] Cards Against Homestuck",f,100448
"In the final battle, John distracts Lord English by showing him ____.",0,1,"MSPA","[C] Cards Against Homestuck",f,100448
"I warned you about ____, bro! I told you, dog!",0,1,"MSPA","[C] Cards Against Homestuck",f,100448
"John is a good boy. And he loves ____.",0,1,"MSPA","[C] Cards Against Homestuck",f,100448
"It's hard, being ____. It's hard and no one understands.",0,1,"MSPA","[C] Cards Against Homestuck",f,100448
"Kanaya reached into her dead lusus's stomach and retrieved ____.",0,1,"MSPA","[C] Cards Against Homestuck",f,100448
"John may not be a homosexual, but he has a serious thing for ____.",0,1,"MSPA","[C] Cards Against Homestuck",f,100448
"Karkat gave our universe ____.",0,1,"MSPA","[C] Cards Against Homestuck",f,100448
"Kanaya tells Karkat about ____ to cheer him up.",0,1,"MSPA","[C] Cards Against Homestuck",f,100448
"I finally became Tumblr famous when I released a gifset of ____.",0,1,"MSPA","[C] Cards Against Homestuck",f,100448
"I just found ____ in my closet it is like fucking christmas up in here.",0,1,"MSPA","[C] Cards Against Homestuck",f,100448
"Hussie unintentionally revealed that Homestuck will end with ____ and ____ consummating their relationship at last.",0,2,"MSPA","[C] Cards Against Homestuck",f,100448
"I am ____. It's me.",0,1,"MSPA","[C] Cards Against Homestuck",f,100448
"How do I live without ____?",0,1,"MSPA","[C] Cards Against Homestuck",f,100448
"Hussie died on his quest bed and rose as the fully realized ____ of ____.",0,2,"MSPA","[C] Cards Against Homestuck",f,100448
"Gamzee not only likes using his clubs for juggling and strifing, he also uses them for____.",0,1,"MSPA","[C] Cards Against Homestuck",f,100448
"Getting a friend to read Homestuck is like ____.",0,1,"MSPA","[C] Cards Against Homestuck",f,100448
"For his birthday, Dave gave John ____.",0,1,"MSPA","[C] Cards Against Homestuck",f,100448
"Fuckin' ____. How do they work?",0,1,"MSPA","[C] Cards Against Homestuck",f,100448
"Feferi secretly hates ____.",0,1,"MSPA","[C] Cards Against Homestuck",f,100448
"For Betty Crocker's latest ad campaign/brainwashing scheme, she is using ____ as inspiration.",0,1,"MSPA","[C] Cards Against Homestuck",f,100448
"Equius beats up Eridan for ____.",0,1,"MSPA","[C] Cards Against Homestuck",f,100448
"Everybody out of the god damn way. You've got a heart full of ____, a soul full of ____, and a body full of ____.",2,3,"MSPA","[C] Cards Against Homestuck",f,100448
"Believe it or not, Kankri's biggest trigger is ____.",0,1,"MSPA","[C] Cards Against Homestuck",f,100448
"Dave Strider likes ____, but only ironically.",0,1,"MSPA","[C] Cards Against Homestuck",f,100448
"Alternia's political system was based upon ____.",0,1,"MSPA","[C] Cards Against Homestuck",f,100448
"All ____. All of it!",0,1,"MSPA","[C] Cards Against Homestuck",f,100448
"AG: Who needs luck when you have ____?",0,1,"MSPA","[C] Cards Against Homestuck",f,100448
"After throwing ____ at Karkat's head, Dave made the intriguing discover that troll horns are very sensitive.",0,1,"MSPA","[C] Cards Against Homestuck",f,100448
"""Sacred leggings"" was a mistranslation. The Sufferer actually died in Sacred ____.",0,1,"MSPA","[C] Cards Against Homestuck",f,100448
"____. It keeps happening!",0,1,"MSPA","[C] Cards Against Homestuck",f,100448
"____ stays awake at night, crying over ____.",0,2,"MSPA","[C] Cards Against Homestuck",f,100448
"____ makes the Homestuck fandom uncomfortable.",0,1,"MSPA","[C] Cards Against Homestuck",f,100448
"FUN FACT: The Daleks were originally shaped to look like ____.",0,1,"DW","[C] Doctor Who",f,100449
